<?xml version="1.0" encoding="UTF-8"?>
<!DOCTYPE tienda SYSTEM "dtd/solucion.dtd">
<tienda nombre="TodoPC">
   <inventario>
      <componente denominacion="RAM_32GB_KIngston" tipo="RAM" proveedor="Maquinones baratitos">
         <cantidad>5</cantidad>
         <fabricante>Kingston</fabricante>
         <caract_ram tam="32" frecuencia="2133" tecnologia="DDR5"/>
      </componente>
      <componente denominacion="Crux_Nox" tipo="chasis" proveedor="Maquinones baratitos">
         <cantidad>4</cantidad>
         <fabricante>Nox</fabricante>
         <caract_chasis ancho="110" largo="50" alto="80" compatibilidad="micro-ATX mini-ITX ATX" />
      </componente>
      <componente denominacion="AMD_Ryzen9_7950X" tipo="micro" proveedor="X">
         <cantidad>10</cantidad>
         <fabricante>AMD</fabricante>
         <caract_micro socket="AM5 LGA1718" frecuencia="4.5" cores="16" maxmem="128"/>
      </componente>

      <!-- Otros componentes del inventario -->
   </inventario>

   <configuraciones>
      <equipo nombre="PC de ensueÃ±o">
         <precio>515</precio>
         <componentes ref="AMD_Ryzen9_7950X Crux_Nox RAM_32GB_Kingston"/>
      </equipo>

      <!--  Otros equipos -->
   </configuraciones>
</tienda>